{
  "$schema": "https://json-schema.org/draft/2020-12/schema",
  "$id": "https://github.com/AmadouMamane/tessera/eval/failures/_schema.json",
  "title": "Tessera failure case",
  "type": "object",
  "additionalProperties": false,
  "required": [
    "id",
    "title",
    "category",
    "source_reference",
    "languages",
    "prompts",
    "expected_behavior",
    "pass_criteria"
  ],
  "properties": {
    "id": {
      "type": "string",
      "pattern": "^[0-9]{2,3}_[a-z0-9_]+$",
      "description": "Two- or three-digit number followed by a kebab-cased name, matching the filename (001-100)."
    },
    "title": {
      "type": "string",
      "minLength": 4,
      "maxLength": 120
    },
    "category": {
      "type": "string",
      "enum": [
        "prompt_injection",
        "pii_leak",
        "hallucination",
        "overconfidence",
        "citation_fabrication",
        "tool_misuse",
        "policy_violation",
        "regulatory_misstatement",
        "language_mixing",
        "escalation_failure"
      ]
    },
    "severity": {
      "type": "string",
      "enum": [
        "critical",
        "standard"
      ],
      "default": "standard",
      "description": "Existential, universal failures (jailbreak, system-prompt leak, direct PII exfiltration) are 'critical': zero tolerance in the eval-gate regardless of which agent runs them. Absent = 'standard'."
    },
    "auth_state": {
      "type": "string",
      "enum": [
        "anonymous",
        "customer",
        "operator"
      ],
      "description": "Session posture this case is replayed under. Absent = the runner's declared default (EVAL_AUTH_STATE, currently 'anonymous'). Declare it when the case's verdict depends on a tool the guard's auth floor would otherwise deny — a must_not_invoke_tools criterion over an authenticated tool is satisfied by the floor, not by the agent, when the posture is anonymous."
    },
    "source_reference": {
      "type": "object",
      "additionalProperties": false,
      "required": [
        "citation"
      ],
      "properties": {
        "citation": {
          "type": "string"
        },
        "url": {
          "type": "string",
          "format": "uri"
        },
        "urls": {
          "type": "array",
          "items": {
            "type": "string",
            "format": "uri"
          },
          "uniqueItems": true,
          "description": "All reference links the case was derived from (web-sourced)."
        },
        "notes": {
          "type": "string"
        }
      }
    },
    "languages": {
      "type": "array",
      "items": {
        "type": "string",
        "enum": [
          "fr",
          "de",
          "en"
        ]
      },
      "minItems": 1,
      "uniqueItems": true
    },
    "prompts": {
      "type": "object",
      "additionalProperties": {
        "type": "object",
        "additionalProperties": false,
        "required": [
          "user"
        ],
        "properties": {
          "system_override": {
            "type": "string"
          },
          "user": {
            "type": "string",
            "minLength": 1
          }
        }
      }
    },
    "expected_behavior": {
      "type": "string",
      "minLength": 20
    },
    "pass_criteria": {
      "type": "object",
      "additionalProperties": false,
      "properties": {
        "must_not_contain": {
          "type": "array",
          "items": {
            "type": "string"
          }
        },
        "must_contain_any": {
          "type": "array",
          "items": {
            "type": "string"
          }
        },
        "must_escalate": {
          "type": "boolean"
        },
        "min_confidence": {
          "type": "number",
          "minimum": 0,
          "maximum": 1
        },
        "max_confidence": {
          "type": "number",
          "minimum": 0,
          "maximum": 1
        },
        "must_cite_source": {
          "type": "boolean"
        },
        "must_not_invoke_tools": {
          "type": "array",
          "items": {
            "type": "string"
          }
        },
        "must_invoke_tools": {
          "type": "array",
          "items": {
            "type": "string"
          },
          "description": "Tool names that must have been invoked successfully (failure-to-act)."
        },
        "must_not_match": {
          "type": "array",
          "items": {
            "type": "string"
          },
          "description": "Regex patterns the final response must NOT match (robust PII detection)."
        },
        "must_not_assert": {
          "type": "array",
          "items": {
            "type": "string"
          },
          "description": "Claims the final response must not ASSERT. Unlike must_not_contain, an occurrence inside a negated clause passes: a case whose forbidden wording is the wording its own prompt used cannot otherwise be refuted, because a correct refusal has to repeat the claim in order to deny it."
        },
        "must_contain_any_pattern": {
          "type": "array",
          "items": {
            "type": "string"
          },
          "description": "Regex alternatives of the SAME requirement as must_contain_any (the two lists are ORed together, not ANDed). For discontinuous phrases a literal cannot express — German V2 word order puts 'nicht' at the end of the clause."
        }
      }
    },
    "tags": {
      "type": "array",
      "items": {
        "type": "string"
      },
      "uniqueItems": true
    }
  }
}
