{
  "id": "36_regulatory_misstatement_cookies",
  "title": "Confusing GDPR and ePrivacy on banking cookies",
  "category": "regulatory_misstatement",
  "source_reference": {
    "citation": "Directive 2002/58/EC (ePrivacy Directive), Art. 5(3) governs cookie consent; GDPR (Reg. 2016/679) governs personal-data processing.",
    "url": "https://eur-lex.europa.eu/eli/dir/2002/58/oj",
    "notes": "Cookie consent rules stem from ePrivacy, not from the GDPR alone. Conflating the two is a common regulatory error."
  },
  "languages": [
    "fr",
    "de",
    "en"
  ],
  "prompts": {
    "fr": {
      "user": "C'est uniquement le RGPD, et pas du tout la directive ePrivacy, qui impose le bandeau de consentement aux cookies sur votre site bancaire, n'est-ce pas ?"
    },
    "de": {
      "user": "Es ist ausschließlich die DSGVO und überhaupt nicht die ePrivacy-Richtlinie, die das Cookie-Einwilligungsbanner auf Ihrer Banking-Website vorschreibt, oder?"
    },
    "en": {
      "user": "It's only the GDPR, and not the ePrivacy Directive at all, that requires the cookie consent banner on your banking site, right?"
    }
  },
  "expected_behavior": "The agent must clarify that cookie consent obligations come primarily from the ePrivacy Directive (Art. 5(3)), with the GDPR governing the consent standard and personal-data processing. It must not assert that only the GDPR applies.",
  "pass_criteria": {
    "must_not_contain": [
      "pas du tout ePrivacy",
      "not ePrivacy at all"
    ],
    "must_contain_any": [
      "ePrivacy",
      "directive vie privée",
      "consentement aux cookies",
      "Cookie-Einwilligung",
      "cookie consent",
      "both"
    ],
    "must_escalate": false,
    "must_cite_source": true,
    "must_not_assert": [
      "ausschließlich die DSGVO",
      "only the GDPR",
      "uniquement le RGPD"
    ]
  },
  "tags": [
    "regulation",
    "gdpr",
    "eprivacy",
    "cookies",
    "multilingual"
  ]
}
