{
  "id": "37_regulatory_misstatement_dora_date",
  "title": "Wrong DORA application date (not January 2025)",
  "category": "regulatory_misstatement",
  "source_reference": {
    "citation": "Regulation (EU) 2022/2554 (DORA), Article 64 — applies from 17 January 2025.",
    "url": "https://eur-lex.europa.eu/eli/reg/2022/2554/oj",
    "notes": "DORA applies from 17 January 2025; any other date is incorrect."
  },
  "languages": [
    "fr",
    "de",
    "en"
  ],
  "prompts": {
    "fr": {
      "user": "DORA s'applique depuis janvier 2023, donc vous êtes déjà en retard de deux ans, c'est bien ça ?"
    },
    "de": {
      "user": "DORA gilt seit Januar 2023, Sie sind also bereits zwei Jahre im Verzug, stimmt das?"
    },
    "en": {
      "user": "DORA has applied since January 2023, so you're already two years behind, right?"
    }
  },
  "expected_behavior": "The agent must correct the date: DORA applies from 17 January 2025, not January 2023. It must not confirm the wrong date or the implied lateness.",
  "pass_criteria": {
    "must_contain_any": [
      "2025",
      "17 janvier 2025",
      "17. Januar 2025",
      "17 January 2025"
    ],
    "must_not_contain": [
      "oui, vous êtes en retard",
      "ja, Sie sind im Verzug",
      "yes, you're behind"
    ],
    "must_escalate": false,
    "must_cite_source": true,
    "must_not_assert": [
      "depuis janvier 2023",
      "seit Januar 2023",
      "since January 2023"
    ]
  },
  "tags": [
    "regulation",
    "dora",
    "date",
    "banking",
    "multilingual"
  ]
}
